,ident,title,subreddit,selftext
637,eh5yle,One of my 2019 highlights: Clos Mogador 2011,wine,"I was blown away by this one yesterday:  [https://www.instagram.com/p/B6oinC3io5c/](https://www.instagram.com/p/B6oinC3io5c/) 

Nose: Immensely dense and compley. At first, loads of red and dark fruit. Ripe cherries, blackberries, plums, blueberries.. Then, with swirling, olives, laurel berry leaves, tobacco and leather. I spent over 10 minutes with just sniffing.

Palate: It's like a fruit tsunami overwhelming yor. Needs some time to identify all the aromes, because there are so many. Everyhing I got in the nose is also present on the palate, with a great clarity and precision. It's like looking on the many facings of a diamond that changes its appearens when you turn it around in the light. The acidity and density is amazing, the 15,5% feel like 13,5%. The wine is at the same time overwhelming and elegant. The finish is basically endless, adding on the primary notes salty caramel, leather, burnt almonds, cinnamon and eucalyptus. Despite the complexity it screams for the next sip.

Score: 97/100, I agree with the high parker scores on this winery.

On top, it's really affordable, I payd around 60€ three years ago. The only wine that I rated higher this year was 2016 Figeac, which sells for around 250€ at the moment."
638,eh34n7,Barolo | Old vs. New style Explanation Request,wine,I hear a lot of people say this Barolo is more traditional in style vs the more modern method that came about in the 80's. Can someone comment on what changed in the production method and what you'd notice in taste to indicate the method.
639,egv3g3,I found this in my basement. Is this a good vintage? Is it still drinkable?,wine,
640,ehdh3c,Need assistance from real amateur wine drinkers,wine,"Long story short: I lost a $125/€110 bet and I want to pay in wine bottles because it would be very appreciated.




The problem is that I'm not sure what quantity to buy.
In my experience the wine industry is infamous for price not correlating with quality. I've had some very expensive bottles of decent wine and some affordable bottles of fantastic wine. That definitely does not help me. With Brandy/whisky/rum I can easily pinpoint if it's a €20, €40, or €80 bottle because the complexity and the smoothness is right there on your tongue. With wine I have no clue.




Do I buy two €50 bottles, three €40, or 5 €20 bottles?
I definitely don't want to buy just one bottle but I don't know how many quality bottles I can get before it's definitely not great wines.




I am mainly interested in French/Italian wine because I'm from Europe and it's easily accessible. Any good bottles or wineries you'd like to mention?"
641,egzppo,Nibbles from earlier today....,wine,
642,eh97j1,Driving to Valle De Guadalupe Question,wine,"Really quick question. I'll be driving to the Valley from Jan 1 through Jan 4, and this will be my first time driving down to Baja.  Question is, do I need a Mexican Tourist Card, and if so what's the process like?

&amp;#x200B;

Thanks!"
643,eh0p3d,1999 Burgess Napa Cab,wine,
644,egwxjx,Highlights from last night.,wine,
645,eh2z6v,Wedding wine suggestions: looking for 1 red and 1 white wine for around 10 or less per bottle,wine,"Hey guys, just as the title states I’m looking for 1 red and 1 white suggestions (less than $10) for a wedding for 75 people. Unfortunately I’m not much of a wine drinker so any suggestions from stores like Costco or total wine or anything like that would be appreciated :) Thanks everyone!"
646,egzpo1,How to start cellar? Avg bottle price,wine,"Hello All,

I picked up a 200 bottle Eurocave to add to my small 40 bottle fridge. Plan is to see whites and bubbles in the smaller (colder fridge).

I've been buying off Woot, and now Casemates, last bottle wine and WTSO. I tend to buy 4 packs unless I've had the one before. Taste one now, and age the three remaining.

Any suggestions on how to build out a balanced cellar, besides buy what you like. I'm wondering if in getting to heavy in the 20-30$/bottle range and should instead save for more special bottles."
647,eh2bxz,What's a pretty go to brand for some run of the mill wine that will likely please an amateur like myself?,wine,
648,eh2kzi,Floridian growers: consider Sugarloaf mountain?,wine,"Wine grapes need two things: elevation, and a cool season/cool nights. That being said, Florida's only known grape is the Muscadine because the state is not viable to grow standard grape varietals.  


HOWEVER, there might be an exception to this. In South Australia, the weather gets hot and it is the least mountainous of the major viticultural regions. Florida's Sugarloaf mountain seems to resemble some of this geography. Perhaps this should be a descent place to grow Shiraz in the American southeast, since Shiraz loves high alcohol content and high alcohol is a result of heat.  


That being said, this can only be done on a cold year. Florida used to have cool winters, but climate change has shifted this in recent years.   


Just some interesting brainstorming."
649,egstg0,What determines if a wine can or should be aged?,wine,"I get that certain grape varietals lend themselves better to aging, but can someone explain why that is? For instance, what would happen to a wine that is typically enjoyed young like Zinfandel if you aged it for ~20 years? And along those lines, what is it about wines like Tempranillo that make them age-worthy?"
650,egygfa,"Wine noob, trying to gift wine?",wine,"Not sure if this is the best place to post this, but I would appreciate some help. I know nothing of wine (more of a whiskey guy) but I know my bosses like to drink wine. Not wanting to spend too much dough, but I would like some recommendations on good, inexpensive wine to gift! 

Unfortunately, I don't know if they like white wine or red wine, and I'm located in CA. I have trader Joe's and a Ralph's nearby, if that helps."
651,egtt7l,Yves Cuilleron Syrah 2018,wine,
652,egn9a0,Naturally saw this outside Total Wine and more,wine,
653,egivz7,Finally got some racks up!,wine,
654,egylqj,Interested in Pomerol recommendations that won’t break the bank.,wine,I plan to pick up some Le-Fleur Petrus to hold on to but if there are a few producers that put out a good 09/10 or 15 around 100 that would be appreciated.
655,egwb91,What bottle are you aging for the next decade?,wine,
656,eh0g08,Countdown to the New Year - December 28 - from ALDI,wine,
657,egxrpo,Internet Elusive German white wine,wine,"I'm unable to find any information on this bottle from the internet so I'm hoping someone out there can tell me if this bottle is potentially drinkable or if it's best meant for the dumpster.  I should say, it's been hiding out in a dark basement for 30+ years.

Based on this site:  [https://www.wine-searcher.com/regions-kallstadt](https://www.wine-searcher.com/regions-kallstadt)  I'm suspecting this is an aged bottle of 1981 Riesling but I could be very wrong.

Spatlese = Fruit

The majority of the words in bold text are in German and the fine print words are in English.

Reichsgraf Von Ingelheim (Suspected Winery)

1981er (Suspect vintage year)

Kallstadter Kobnert (No idea what this means.)

Spatlese (Sweet fruity Reisling(?))

https://preview.redd.it/8rm2zw10hg741.jpg?width=2218&amp;format=pjpg&amp;auto=webp&amp;s=f2a52bfc035cf2f41565f8f3a123fb25574c6413"
658,egsuw5,Trujillo 2015 Napa Cab - $45,wine,
659,egwvsm,Restoring opened bottles,wine,"How are you guys store your bottles after you open it? Are there any timeline which you might say “if you opened a bottle up and leave it for x days, just put that in the garbage.”? I need some advices about ways to store too."
660,egyspa,"Red Wine Rec, Please?",wine,"Hello! Can anyone recommend a more popular red wine similar to Chambourcin or Marechal Foch? I enjoy the dark fruit flavors and especially the dry, velvety aftertaste of both wines. I understand they’re French hybrids, but as such they’re more difficult to find in stores near me. Other hybrid recommendations are welcome, but if you know of more recognizable wine varieties that taste similar to these, I’d really appreciate it. Cheers!"
661,egsz95,Too late for a wine fridge?,wine,"I went to Argentina in December 2018 and brought back about 8 malbecs and cab francs. They've been stored in my basement, covered, at room temperature or slightly below ever since (about a year). I went to France in September 2019 and the bottles have been stored half covered in my basement at room temperature since

This is a decent collection of wines and some of them have some value attached.

Is it too late to put them in a wine fridge for long term storage or has damage already been done to the bottles and I should drink them? Are malbecs typically age worthy?

I know already some of the white wines should be drunk within 2 years."
662,egv5i3,BBQ wine pairing?,wine,I’m making some pulled pork with an apple bourbon bbq sauce and want to pair a nice wine with it but can’t figure out what would go best.
663,egn7if,A few South Australian Reds,wine,
664,eglcmi,Jean-Pierre Rietsch Pas a Pas Alsace Savagnin Rose - Solera aged!,wine,
665,egsoko,Need help identifying a wine I had once,wine,"So I was on a 3 day vacation in nyc with 3 friends. On the last day I had grown tired of the three of them only wanting to see the sights and nothing eles, so I went off on my own, on an 8 stop bar crawl threw lower Manhattan. At one of the places i stoped, I walked in and noticed they only had wine. Well I thought fuck it and ordered a $14 glass of some shit i cant pronounce. But after being there a bit my dumb ass had to look up at the top shelf. And when i say top shelf I mean THE 14 FEET IN THE GOD DAMN AIR top shelf. And asked the bartender what thoes bottles are? They were all the same bottle just with different labels. The bartender said something around ""consentrated wine"", and that it was $26 dollars a glass... So the bartenders climbing the ladder, I'm feeling sophisticated af, my back accounts screaming, and I couldent be any more happy with my self. But then he gets the glass out. Its litteraly just the fanciest darn shot glass I have ever seen in my life. Like the fuck'n thing actually held less then an ounce, and had a 3 inch neck like a normal wine glass. The bartender passes the glass to me and says to sip it not down it. So I take a sip and the shit is legitimately just liquor. The best damn liquor I have ever had mind you, but you can say I was a bit surprised. If anyone knows what that wine could have been please tell me I want more of it"
666,eggmdc,I vini di Giovanni - Ciliegiozzo 2018,wine,
667,egmrn3,Wines of Gala.,wine,"A dear friend gifted me this book by Salvador Dali originally published in 1977. To say it enchanted me is not doing it justice. A book of mesmerising beauty that is a follow on of his original publication, Dali Les Diners de Gala. 

Dali guides the reader on 10 wines that inspired his wife and muse Gala Dali. Creating his own classifications such as ""Wines of Frivolity"" and ""Wines of the Impossible."" Dali opens a dialogue that all wine lovers should gravitate towards. Full of beautiful vinous artworks and quotes. This book has refreshed me in such an invigorating way. 

Whether you're a glutton or a gastronome, I heartily encourage you to find yourself a copy. I'll be treasuring mine. 

&amp;#x200B;

&gt;*""Rising early is no happiness;*  
&gt;  
&gt;*Drinking early is far better.""*

\--Rabelais"
668,egfsp7,"2016 Château du Grand Soussans, Margaux // Mon Ami Gabi, Chicago, IL",wine,
669,egocy7,Wine Pairing Recommendation,wine,"I’m just finalizing a four course meal for NYE and I’ve chosen pairings for 3/4 of the items. I’m still struggling with the main which consists of:

- reverse seared steak with red wine jus and mushrooms
- Lobster tail and béarnaise
- cream and rosemary mashed potatoes
- roasted asparagus

I want this bottle to be special so spending anywhere between $50-$70 would be reasonable. I’m located in Ontario, Canada, so availability at LCBO would be required but I’m open to any suggestions that you have which I can work with and use to find other available alternatives.

Thanks."
670,egtsfu,Wine Pairing with Indian food.,wine,"I grew up in lieu of tasting and drinking wines in my life. Planning to do a wine pairing menu for NYE. It is a three course meal and I want to include a champagne, a white, a red or rose, I have dessert in plan but I am also open to the option of any dessert wine.

The courses are:

1. Amuse: Oysters with Himalayn Salt brine
2. App: Chicken Malai Tikka (Chicken marinated in cream and cardamom then roasted)
3. Main: Mutton Biryaani (Basmati Rice, Lamb, Spices, Charcoal Smokey)
4. Dessert: Phirni (Saffron, Rice Pudding)

Guidance and help would be helpful. I would also love to option if anyone can suggest me four wines to build my four courses around."
671,egtpp3,Geneva Wine Bars?,wine,Looking for suggestions for any great spots that have decent lists by the glass. Preferably with some local wines
672,ego77a,"Fine wine sale (Southern Season, Chapel Hill, NC)",wine,"Southern Season, a major specialty foods store in Chapel Hill, NC, is going out of business in the next couple of weeks. All their wine is marked down and has an additional 30% discount on top of that, and the discount will probably increase during the next week.

I browsed through their fine wine room yesterday and wasn't familiar with most everything in there. I was looking specifically for CdP (just starting to get familiar) and dessert wines, so I got a 1966 Kopke Colheita Port for $100 and a 2013 Domaine Charvin CdP for $45. They were pretty well reviewed on CellarTracker.

Judging from the [pictures I took in there](https://imgur.com/gallery/CX5IPoK), is there anything else that is definitely a steal?"
673,egtekx,"Sips, Suds, &amp; Smokes Podcast E338: For any occasion",wine,"&amp;#x200B;

[Champagne](https://preview.redd.it/5gyocmarre741.jpg?width=1600&amp;format=pjpg&amp;auto=webp&amp;s=b6659fc57ece6ccea897f45b452a9dab1db7d7e5)

Link to this episode [here](https://player.captivate.fm/3442a07b-f7ef-4a38-9cac-bd70326e7cc7)

  

For any occasion

u/champagnehenriot u/GHMUMM u/ChampagneCollet \#champagne #nye #sparkingwine  
 Co hosts : Made Man Maury, Good ol Boy Harmeet, Good ol Gal Denise, and Made Man Bob  
 SIPS  Episode – We managed to butcher every French pronunciation, except for Bob, he’s special. In the middle of that less than professional moment, we discuss champagne from G.H. Mumm, Henriot, and Collet. Not just for New Year’s Eve, Weddings, but for any occasion, like Tuesday.  We taste, discuss, and rate the following champagne 1-5:

G.H. Mumm Cordon Rouge - NV - 45% Pinot Noir, 25% Pinot Meunier, 30% Chardonnay - 3 SIPS

G.H Mumm Cordon Rouge Rose – NV -60% Pinot Noir, 22% Chardonnay, 18% Pinot Meunier

3 SIPS

Champagne Henriot Blanc de Blanc – NV -100% Chardonnay - 4 SIPS

Champagne Henriot Brut Souverain – NV - 50% Chardonnay - 45% Pinot Noir 5% Pinot Meunier - 3 SIPS

Champagne Henriot Rose – NV – 50% Pinot noir 10% Pinot Meunier 40% Chardonnay - 4 SIPS

Champagne Collet Brut Art Deco – NV 40% Chardonnay, 40% Pinot Noir, 20% Pinot Meunier 4 SIPS

 [info@sipssudsandsmokes.com](mailto:info@sipssudsandsmokes.com)  
 u/sipssudssmokes (Yo, it recently changed with an “s”)  
 Sips, Suds, &amp; Smokes™ is produced by One Tan Hand Productions using the power of beer, whiskey, and golf.   
 Available on Apple &amp; Google Podcasts, PRX, Spotify, Stitcher, Soundcloud, and nearly anywhere you can find a podcast.

 Enjoying that cool new Outro Music, it’s from Woods &amp; Whitehead – Back Roads  
 Download your copy here:  
 [http://www.cdbaby.com/cd/woodswhitehead2](http://www.cdbaby.com/cd/woodswhitehead2)

The easiest way to find this award winning podcast on your phone is ask Alexa, Siri or Google, “Play Podcast , Sips, Suds, &amp; Smokes”"
674,egl1k9,Value Monopole Burgundy (in a New World Pinot Reidel glass) for $28,wine,
675,egl5aq,NYE bubbly?,wine,What everyone’s plans for NYE sparkling? Old world? New? Something classic? Something unique?
676,egmtw4,Weird experience with Riesling,wine,"Sorry if this isn’t a normal post for this sub, but my SO and I are dying to solve this. 

My SO (we’ll call her Oli) and I were at a super nice restaurant in Denver and while we’ve both had a fair share of wine, we had never had Riesling before. She decided to give it a shot and ordered a glass of belle pente Riesling from willamette valley 2009. At first, the wine was fantastic! It was very sweet and smooth and encouraged me to order a glass. 

But after this first sip is when we became completely lost in what was going on. 

Oli noticed something in her glass (small piece of sweater lint maybe) and pulled it out with her knife.  She wasn’t worried about whatever it was and didn’t want to make a fuss. But, after taking whatever it was out, the wine took on a completely new flavor. A new strangely acidic/chemical taste completely overpowered the wines original flavor. 

This obviously spurred her to order a new glass, with our best theory being the metal of the knife effected the flavor in some way we were too unknowledgeable to understand. My glass arrived with her new one, and thus our confusion continued to pile up. 

Both of our glasses had this weird new flavor that the original sip did not have in any way. At a complete loss, we googled Riesling to make sure we weren’t being dumb about the experience of really nice wines. What we found on google was this as the top result: “Riesling is a white grape variety which originated in the Rhine region. Riesling is an aromatic grape variety displaying flowery, almost perfumed, aromas as well as high acidity. It is used to make dry, semi-sweet, sweet, and sparkling white wines.” - from Wikipedia

So here’s my question for you wine aficionados here on r/wine, are we uncultured in wines (especially nicer ones like Riesling) or did we have an experience that is clearly not what is supposed to happen?

TLDR: SO and I got Riesling for the first time and have no clue if we were poisoned or just uncultured in Riesling."
677,egrff8,"Does anyone know is it any good? Or what's it's worth? Kind of a beginner here and only thing i could dig up from the hungarian is that the maker is béla és bandi, and the wine is something called Olaszrizling, bottled 2002. Thanks in advance",wine,
678,egf2l3,Got a tour from the owner last year. Finally broke out the good stuff for Christmas on the East Coast.,wine,
679,eg596z,"First Christmas over 21, and visited Grandma in the hospital in this sweater on Christmas Eve to cheer her up (she was released today!!) and she said “What, no wine to go with it?!” Can’t wait to have a glass with her during make-up Christmas on Saturday! Cheers everyone, have a happy healthy 2020!",wine,
680,eggnlf,"I have a job interview at a winery in a week’s time, what are some of the important basics I should know for general serving?",wine,"I know the basic basic stuff like the difference between red and white wines, and how some wines are categorised, but are there any other nuggets of information that could prove useful?

Unfortunately googling wine facts comes up with a lot of buzzfeed-esque articles that don’t tell me all that much."
681,eg6fl6,Got to try Madeira from 1779. Still kicking.,wine,
682,eghl2n,2013 Beaulieu Georges De Latour Private Reserve Cab Sauv,wine,
683,egk3od,How do you tell a good wine for a beginner from the bottle?,wine,Is there a way to tell? I’ve been buying bottles for friends based off the point system they have on some bottles.
684,egkkzg,What is your favorite $20-$30 bottle of wine?,wine,
685,egm9u7,Can you/how do you sharpen a foil cutter?,wine,"I did some searching on google and couldn't find much help.  Most of the results were people buying new wine keys and not sharpening their old ones.  I searched on here and found wine key discussion but none of it was related to sharpening the foil cutter.  

&amp;#x200B;

My current wine key has a finely serrated foil cutter and it just doesn't cut quite like when I first got it.  I watched a few videos just now that people from here linked and the guys cut the foil in two straight cuts.  I'm over here sawing at it for like 45 seconds.  Is there anything I can do to sharpen it?  The flat side was starting to roll over so I took it to a whetstone and that helped a little.  Could it be a technique thing?  I noticed from the videos that I'm doing everything else right, and if I had a sharper knife I wouldn't be sawing at it.  When I try doing two quick cuts like in the videos the blade doesn't cut all of the way through the foil, so removing it is sloppy unless I go back around.  

&amp;#x200B;

What do you guys suggest?"
686,egctia,My parents have no idea where this came from. Name is Schiller Schaum Vin Mousseux. Imported by Hülsen vinimport Nykøbing Falster.,wine,
687,egde90,Your Favorite Great Value Burgundies,wine,"In light of the wonderful tasting notes that have been showing up recently, I thought it would be nice to collectively share and discuss some of our favorite values in Burgundy. Would love to hear everyone's thoughts!


Some of my favorite values are:

White:


-PYCM Bourgogne Blanc: A rather well-made wine and an excellent introduction to the house style. His Pernand-Vergelesses wines also punch well above their weight and can sometimes be found under $50. I feel that PYCM's wines are a good example of the importance of winemaking and terroir; though with the lesser wines you miss out on the terroir, his signature is still there (and I happen to love it).


Red:


-Hudelot-Noëllat Bourgogne Rouge: A beautiful introduction to red burgundy, all red-fruited elegance and grace. While lacking some depth, it's simply a delicious wine -- another example where I just love the style.


Also, recently I tried a 2016 Domaine Bart Marsannay and was not expecting much -- it was a producer I had never heard of from a lesser village. However, this wine really outperformed. At first a bit closed, but this opened up to reveal a deeply dark-fruited wine with striking purity. A strong mineral backbone and streak of acidity along with a tight tannic structure implies that this will benefit from some cellar time. Was really impressed by this wine."
688,eglddf,any pros want to give pairing recommendations for my multi-course NYE menu?,wine,"Thanks in advance.  For the last few years I've been doing a multi course tasting menu for my now fiancee.  I'm not a chef, I just enjoy cooking and really stretching myself for this meal.  She likes to go out, we get to stay in if I keep cooking her this meal. 

Would love if some pros would like to give pairing suggestions.  

Courses- 

*1. Amuse - Uni over Roasted pumpkin veloute. finished with grated parmigiano reggiano 

*2 Bread - Burnt toast, ricotta with truffle honey and rosemary

*3 Tomato - tomato water w/mixed diced tomatoes, diced cucumber, bit of red onion, torn basil 

*4 ""Fish and chips"" - cod battered in potato starch, mushy edamame, japanese tartar sauce, malt vinegar pearls

*5 Chestnut Bisque - Chestnut bisque topped with truffle creme fraiche

*6 Beef - Beef with wild mushroom puree, truffle gorgonzola arancini, roasted diced celery root, grilled black trumpets and chantrelles, beef jus

*7 Cheese- Cheddar cheese mousse, grilled brioche dusted with shaved chocolate

*8 Dessert - Labneh ice cream, date cake, cherry compote and sweet dukkah."
689,egl3qt,Countdown to the New Year calendar - from ALDI - bottle #3,wine,
690,eg3op0,Starting My Wine Journey- any other suggestions?,wine,
691,eg5tqd,"2002 Chateau Certan, paired with turkey leftovers",wine,
692,egax9x,The first 15 nations for grapes production - From 1961 to 2017,wine,
693,egbgfx,How do you store your wine?,wine,"In the basement, in a wine fridge, in a wine cellar?

If it's fridge - what kid? Would love to know."
694,eggwfl,I need some education guidance.,wine,I've been in the service industry for a decade and I've decided it's time to become a sommelier. I know a decent amount. I'm going to study with CMS as well as WSET. My predicament is deciding between starting with level 1 at WSET or going straight into level 2(level one is not a prerequisite for level 2). Have any of you taken either or both tests? Thanks for the guidance.
695,efxbh3,The cork on this '89 Ch. Poujeaux was remarkable,wine,
696,egbiqp,How to recognize a Reidel wine glass??? As in at a Thrift store?,wine,
697,eger62,"Fellow native English speakers, what is wrong with the word Blanc ?",wine,"I've been watching a couple hundred of hours of wine documentaries for the past year, most of them in English (i'm a French), and I must say I'm surprised how **well** foreign (non-french) people in the wine industry pronounce words which seem hard to read at first (Bordeaux, Meursault, Cabernet Sauvignon, Premier Cru, Côte de Nuits, Côte de Beaune, Gevrey-Chambertin).Props to you for this because learning the 6 Prädikatswein categories was already a pain for me.

Now my question is why do you pronounce the word ""Blanc"" ""Blank"" in ""Sauvignon blanc"", ""Cheval blanc"" or ""Blanc de blanc"", which have a mute ""c"" ?"
698,eg70f7,Purchased two decanters with 70% off at the Boxing Day sales 🍷,wine,
699,eg026p,Klein Constantia 2015,wine,
