,ident,title,subreddit,selftext
0,egg1bz,US r/wine-rs. Add your voice in opposition to the proposed 100% tariff on European wine.,wine,"People are going to go out of business if this happens. Lives will be ruined.

**Click Here to Email Your U.S. House Representative:**

https://account.votility.com/enterprise/NAWR/ec/698

**Click Here to Email Your U.S. Senators:**

https://account.votility.com/enterprise/NAWR/ec/697


**WRITE THE U.S. TRADE REPRESENTATIVE**
 
Below is wording for a letter that you can use to write to the U.S. Trade Representative at the website they have created to take input on proposed tariffs.

1. Copy the letter below (or add personalization as you like).

2. Then click on the link at the end of the letter.

3. Then paste the wording into the box provided for writing commentary. Remember to put your name and address in the area reserved for them.


The Honorable Robert Lighthizer
U.S. Trade Representative
Executive Office of the President
600 17th Street, NW
Washington, DC 20006

 

Re: Opposition to Tariffs on Imported Wine from the European Union

 

Dear Amb. Lighthizer:

 

I am writing as a customer and consumer of imported and domestic wines that is concerned with the multiple rounds of tariffs that are being imposed and considered on wine from the European Union (“EU”). I strongly urge you not to punish me, or my fellow wine lovers, or hardworking wine retailers, for problems we didn’t cause. It’s unfair at face value. You should punish those responsible. Punishing Airbus and their suppliers and French digital services companies would be much more effective, as well as fair.

Beginning on October 18, 2019, the U.S. Government imposed a 25-percent tariff on certain French wine as part of retaliatory tariffs against the European Union (“EU”) after the World Trade Organization authorized retaliation for the EU’s failure to comply with WTO rulings on subsidies provided to Airbus. All the while Airbus itself was only issued a 10% tariff. I understand that a 100-percent tariff is proposed on French sparkling wine (consisting mostly of champagne) and that this tariff is part of the Section 301 duties imposed on imports from France as a result of the country’s Digital Services Tax (“DST”). Finally, on December 10, 2019, USTR proposed imposing tariffs of up to 100 percent on all wines from the EU.

Because of these import tariffs, the prices will go up dramatically for wine. Margins on wine are extremely small, and the sale of wine is highly regulated, with virtually every state imposing a three-tier distribution system with markups occurring at each tier of distribution. Thus, a 25-percent tariff on wine imports will likely result in a 50-percent increase and a 100-percent tariff on wine imports will likely result in a 150-percent increase in prices for a consumer like me.

 

There is no substitute for imports of wine from the EU. Wines from the EU are different from domestic wines and wines from other countries as a matter of consumer taste. In addition, because it takes many years to plant new grape vineyards and allow the vineyards to produce mature fruit that can be harvested to make wine, it will take at least a decade before the U.S. domestic wine industry could ever be in a position to begin replacing wine imports from the EU.

 

As a wine consumer, I do not understand why individual consumers like me and small U.S. businesses should suffer because of a dispute involving Boeing and Airbus or France’s digital services tax. Retaliatory tariffs on these matters should target Airbus and their suppliers who benefitted from the subsidies, and French digital services companies.


**Click To Email the above letter to the U.S. Trade Representative:**

https://www.regulations.gov/comment?D=USTR-2019-0003-2518"
1,epsjwk,***MWC Experimental Series #1 - January 2020 Tasting Notes Post!**,wine,"Hi Everyone!

Welcome to the first tasting notes post for 2020!  It sounds like this might prove to be a popular change to the MWC based on the selection post, and I hope that it is echoed in this thread!  I hope everyone has had a chance to find their selections.  I had to order mine in (NZ pinot is not very easy to find here locally beyond Kim Crawford.  But I was able to find a couple, and I hope you did too.  If not, no worry, just post what you were ablle to find!   As a reminder, this  months selection is:

**Grape:** Pinot Noir  
**Country and Region #1:** USA, Pacific North West  
**Country and Region #2:** New Zealand, Any

That's right!  Two wines this month!  And as a reminder, if you can only find wine from one region and not the other, thats quite alright.  Just post what you can.  Remember, in your notes, be sure to include: a) a link to a picture of the bottle  and a filled glass; b) the name (if there is one), the producer, the  country/region, the year; c) your notes; and d) your overall  recommendation (whether beautiful or terrible, food pairings, etc.).

Need help with your notes?   [Wine Folly has a great article!](http://winefolly.com/review/write-excellent-wine-tasting-notes/)

I look forward to reading your notes!  And as always, I am open to suggestions for future challenges, including for the Experimental Series!"
2,euyqfh,Sweet Mother of Beaujolais. Yann Bertrand - Phenix,wine,
3,euv17k,Pretty good .,wine,
4,euywej,Ch. Giscours 2005 - still exciting 15 years later,wine,
5,ev69hk,Vertical tasting of 8 Bollinger VVF (1996-2010) from back in September - My biggest wine experience ever!,wine,
6,euoxht,Pleasant surprise from a monster Turley,wine,
7,eutp9c,"Just bought this, was looking for some advice on the best way to drink. Should I decant? etc, thanks!",wine,
8,eux5hy,ANONIS 2017 by LE GRAPPERIE,wine,
9,ev29dx,The Lacroix of wines,wine,
10,ev60np,Venice Day Trips Wine Tours,wine,Has anyone ever done a tour through Venice Day Trips?  If so would you recommend it?  Thanks.
11,eusmy9,Domaine de Villaine - Bouzeron - Burgundy aligoté,wine,
12,euzb2n,Free smoke taint tests for bushfire-hit grape growers in South Australia,wine,
13,euyl5s,Piquette? Really?,wine,
14,ev3wx0,mulled wine question,wine,"peeps can you make mulled wine without cooking it in a sauce pan, like just putting the spices and waiting for them to infuse sangria style ?"
15,euzzl5,Going to Burgundy in May,wine,"Hi, I'll be going to Burgundy during May and was wondering if I could get some info on the some wineries I have to visit. Some sites recommend Joseph Drouhin and Olivier Leflaive for visits but are they worth the price, especially the premium options. Cheers"
16,euwnpp,"At 2°C of warming, the area suitable for wine grapes could drop by 56%; at 4°C, 85%. Switching grape varieties could greatly reduce climate change impacts on wine growing regions. But there are limits to this adaptation; it's much more effective at +2°C than +4°C",wine,
17,euw1zc,Does anyone else have a problem with peeling labels? Only seems to happen to the far niente bottles. Both the Chardonnay and Cabernet do this. Non of the other bottles do. Is there a way to stop this or fix it with out damaging it?,wine,
18,ev1rd7,Widely Agreed Upon Wines,wine,"So with mid range bourbon almost everyone agrees on ones like Elijah Craig, Knob Creek, Makers Mark.

What Wines are in that higher mid range that everyone agrees are must trys :)"
19,ev1a6s,Any San Francisco have recommendations on a good wine bar?,wine,I'm visiting SF and I'm looking for places that sell by the ounce or have flights available. Ideally a nice space for me to do a mini wine class for a friend who wants to get into wine.
20,eukatf,1984 Ste. Chapelle Riesling,wine,
21,euxx0z,Napa Cabernet by Price,wine,
22,euvxc8,Looking for a summer job,wine,"Hi,

I'm a 23 year-old man from the Netherlands working at a wine bar and busy with the Dutch equivalent of WSET3.

For the summer, I'm looking for a winery (preferably in France or Italy) to work at. I could help with tours, hospitality services or some others jobs if needed. I'm not interested in earning any money, just looking for a place to stay and learn about wine for about two weeks.

If anyone has a tip or suggestion, please let me know! 😊"
23,ev0k6p,Help me know more about this wine,wine,"Okay, so I bought this wine in Argentina a couple of years ago when I was 15-16 (my dad bought it, I just handed him the money) and I brought it home with me, I know it is a cheap wine but I was wondering maybe what is the price point or maybe some facts/advise that you could tell me about it. Thanks a lot.

https://imgur.com/gallery/jLXdHd2"
24,ev0iz4,Climate Change Could Shrink Wine Regions Dramatically,wine,
25,eug4f0,Visited Napa for the first Time. Was Not Disappointed.,wine,
26,euu194,Any tips on getting out of a wine club...?,wine,"Also posted in /r/legaladvice, but I suspect you guys will have some interesting answers. :) 

I recently moved and joined a wine club through a local shop: every quarter there's a club event with food/drinks and you pick out your wine from multiple local wineries. If you do not attend the event, you get assigned wine from whatever is left over and you pick it up/it's shipped.

My job has unexpectedly involved a lot of travel lately, and I would like to bow out of the club*. I responded to their most recent email - an invitation to the next member event - letting them know I can't attend due to work, and in light of my new job could I please cancel my subscription and hopefully rejoin in the summer when travel will have subsided? I was told ""we can let you skip this one event, but our wine club membership is for one year."" 

If I'm stuck in this club I'll live, of course. But has anyone else successfully extricated themselves from a club...and how? 

*In the event it's important, reasons include: I've missed previous wine club event since joining due to work-related travel for a new job and the event itself was my main reason for joining - so I could make local friends!, my fiance decided to stop drinking wine which makes a club less economical/fun...and frankly, I am not very impressed with the wines they have chosen for me."
27,euytmq,Wine suggestions while in France (Provence),wine,Will be traveling to France and spending most of my time in le sud. The plan as of now is to pick up wine in town at the store and take with us to have picnic style at various locations when hiking/exploring the country side and beaches. Any suggestions on wines to be on the lookout for? Options that are both affordable and ones that are “only in the south of France” are greatly appreciated! Personal preference is red but am well aware the region is known for rose!
28,euvi2x,I am a starter in white sand I enjoy Sancerre and Pouilly-Fumé ones the best. Where to go to enjoy other grapes or other regions next?,wine,
29,euru8c,Recommendation for under $75,wine,"Hi all, 

My fiancée has a huge celebration coming up and I want to get a nice bottle of wine for her to pair with the Zalton Bordeaux glass I got her. 

Looking for a Cab Sav. I live in PA, so somewhat limited based on what the state has. 

She likes dry, oaky, fruity, tobacco notes.

The last “nice” bottle we had was Palermo Orin Swift I believe is what it was called. She liked it a lot. Was hoping to find something even better than that. 

Hope this helps and hope you guys can help me!"
30,euro1i,Are these 4 2017 Bordeaux bottles worth $180?,wine,
31,eux6h4,California whites,wine,"Whenever I try a Californian wine, it's always as nervous as my dog when the doorbell rings... Is there better regions or grapes for whites, down there? Some kind of guidance for my next trip to the wine store? 🙃"
32,eud77k,"Alain Graillot Crosez-hermitage, 2017 + Cheetos Flamin' Hots NV",wine,
33,eu85ze,"Celebrating my birthday a week late, but worth the wait.",wine,
34,eusrgn,Decant these or not?,wine,
35,eudz5g,Subway sparkling wine,wine,
36,euj60q,"King Estate Hyland Vineyard Pinot Noir, Willamette Valley, 2010",wine,
37,eunrv7,How long will a wine last after being punctured by a Coravin system?,wine,"I am thinking about picking one up, but would like to keep the bottle over a few months/years instead of a few weeks once punctured with a coravin system.

I've heard mixed things. 

Does anyone have experience here?"
38,eups4j,Suggestions for Valentine's day,wine,I'm sure this subreddit gets asked questions like this alot but I would like to get a nice bottle of wine for Valentine's day. We are going away for the weekend and I've been looking into wine related videos on YouTube and I think we would like a wine that is on the sweeter side of the spectrum. Thanks in advance!
39,eusy80,What is the best dirt cheap/grocery store wine that actually tastes amazing?,wine,
40,eurfaj,Cheapish ($20) bottle to pair with a steak served with a bernaise sauce?,wine,Title. Thank you.
41,eubjc5,2018 Morgan No S02,wine,
42,eugceh,Had these with dinner a few nights ago,wine,
43,euisib,Reynvaan Family Vineyards - 2015 “Foothills in the Sun” Vineyard,wine,
44,eujw7a,How to start a wine collection when moving around a lot?,wine,"So I've recently got more into wines as a hobby rather than something I pair with food because the internet tells me to. I want to start collecting wines to age and drink later, but for the next few years I'm basically living out of hotels due to the nature of my work. I cant really get a wine fridge, can't keep things in one place for very long, and also working with limited space.

Should I shelve this hobby for now and wait? Any wine cellar rentals that you guys reccomend? Any way to store wine otherwise?"
45,euabnr,Finally decided to crack this open after my travels,wine,
46,eujani,What do I do with old expensive wine? Not in a cellar but in cool dark space for years. ()Chateau haut-Bruin 1959,wine,"
Chateau  haut-Bruin 1959 red Bordeaux   - seen online for 3200$ Usd
Chateau Lafite-Rothschild 1959 - seen online for 3800-7200 

Are there resources for this type of thing?"
47,eu9jba,ProTip: Berserker Day is tomorrow!,wine,"Berserker Day is an annual event put on by one of the more active, independent wine forums, https://www.wineberserkers.com/.

As the forum consists of small producers and enthusiastic advocates, the selection (and deals) are very solid.

Yes, we do participate as well. If you wanted to take a look at our site prior to seeing our Berserker Offer on the forum, you can find it at www.BevelaWines.com.

Check out the forum’s offers, and find some new treasures. Cheers!"
48,eu9ndt,We decorated the shelf in our apartment with our favorites from the last year,wine,
49,eujb2v,Best red wine based cocktails? xpost /r/mixology,wine,
50,eudrgw,Just getting started and I need help,wine,"Winos of Reddit, I need your help.

So I’m a pretty young guy and I’ve been slinging beers and wine at my local beer and wine bar as a part time gig while I’m finishing my degree. I’ve always been into craft beer, but lately I’ve been trying to get more into wine. I like wines of pretty much all varieties, although I admit cab sav is usually my go to. That being said, I’m trying to learn more about wine and diversify my pallet. Damn if this isn’t an intimidating hobby to take on. Luckily, I live in Boulder and have access to a pretty huge variety of wines (our main liquor store is enormous and probably has 10,000 different bottles at any given time). Can anybody recommend some resources to help me learn about wine, as well as some awesome affordable wines that I should start with? Are any boxed wines any good? Whatever you can do to point me in the right direction would be greatly appreciated!"
51,euid58,Ideas for entertainment at a wine tasting event,wine,"First of all...let me say that I don't drink ANY type of alcohol, so this is VERY new to me. 

I'm hosting a charity wine tasting event in a few months. Obviously there will be food as well, and I'm working on bringing in a gypsy jazz band, we'll have some vendors, and I'm getting some stuff together to raffle off for the charity...but I'm looking for a few more ideas on things to keep people entertained for the 4 hours that the event is happening. Since I've never been to a wine tasting before, I'm not sure what fits...and would appreciate any suggestions. 

Thanks!"
52,euhzie,Can anyone give any more info on this 40+ year old wine I was gifted? Can’t find anything online but empty novelty bottles.,wine,
53,eudmkm,Small wineries for trip to Napa,wine,"I’m heading up to Napa in a couple of weeks and was looking for some tasting recommendations of small wineries. Price isn’t really an issue and a couple on my list already are:

O'Shaughnessy
Farella
Modus Operandi
Revana
Trinchero

Thanks all!"
54,etw6up,1995 Horizontal...,wine,
55,eu1hze,Guidobono Langhe Nebbiolo 2018,wine,
56,euauvb,Napa drivers,wine,"Any recommendations for Napa drivers for a multi-day custom itinerary? Not looking for anything flowery, just good, reliable driver company you’ve had a good experience with."
57,eua5ka,le cache vs eurocave?,wine,"can anyone speak to a comparison of these two companies? for purposes of the question, price is not the most controlling factor in terms of the info I'm looking for. just curious about using one of these two to store 75-150 bottles for long term in a home. Thanks!"
58,etymqc,Jettlynn winey 2014 Zinfandel Reserve,wine,
59,eu5ynd,Storing a couple of bottles of expensive wine,wine,"I've recently had some incredible wines at a fancy restaurant and want to buy a couple of bottles of them. These wines are a few hundred bucks per bottle, so I'd like to make sure I don't do something stupid to ruin them.

What's the best way to store valuable wine in a California apartment? There are temperature fluctuations - from 55F on winter nights to maybe 85F on summer days; I expect to store the wine for up to a few years, to open on special occasions. I read that I need to store it in the dark, on its side, and that storing in the fridge is not a great idea.

Do I need a wine fridge or something like that, or it'll be fine just being in a dark closet?

Thanks!"
60,ety2ka,Made a pronunciation guide for Champagne's Grand/Premier Cru villages. Here you go!,wine,"My tasting/theory group went deep on Champagne last week, and the one thing that reliably tripped people up was pronunciation. Bouvreux, Puisieulx, Reims, Coquard, Vesle, etc.

So I wrote up a guide for the group to help them out and I thought I'd share it with this community too.

Here's the [PDF](https://truewine.io/wp-content/uploads/2020/01/Champagne-Village-Pronunciation.pdf) and [zip of audio files](https://truewine.io/wp-content/uploads/2020/01/champagne-audio-files.zip). The PDF lists each village with a sort of anglicized pronunciation, and the zip contains my very best go at the true French pronunciation. 

Cheers!

P.S. I also recorded a video covering all of the Grand Cru villages, each with a quick overview. [Here's a link to that](https://www.youtube.com/watch?v=ICcaMULDv5U) if you're interested!"
61,etxqdy,2006 Max Ferd. Richter Veldenzer Elisenberg Auslese**,wine,
62,etw1yu,"TIL following a poor review, Robert Parker was invited to France to re-taste the wines at Chateau Cheval Blanc, where he was promptly greeted, and attacked by the vineyard manager's dog!",wine,
63,etzlhi,Bordeaux Bargin Bin,wine,
64,eu05kz,Heading to Champagne,wine,"Hi all! I’m heading to Paris in the fall and am taking a day trip to Champagne, specifically Reims. 
Are there any small houses or grower tasting rooms/estates that are must a must visit? I’m not looking to go to any of the big producers, I’d much rather support smaller producers. 

Thanks!"
65,etsc4m,"Recently moved to SA, diving into the scene here",wine,
66,etqa5e,My first Israel wines from Golan Heights Winery,wine,
67,ettztl,I have some confusion about Cheverny AOP?,wine,
68,etwdf4,"Meinert ""Synchronicity"", Devon Valley (South Africa) 2004",wine,
69,etx6r2,Should I buy a coravin?,wine,"I'm a solo drinker who likes drinking nice bottles by the glass with no one to share them with.

I travel a lot and would like to bring home bottles I can enjoy over a few months / weeks rather than just one sitting. My family doesn't mind wine, but doesn't appreciate good bottles.

Is it worth it to buy a coravin? Will I truly be able to drink nice bottles by the glass?"
70,eu34j6,19 yo new to drinking and im starting to really love wine.,wine,"I got into wine at 16 years old because of my grandfathers wine cellar on his land. He gave me a quick lesson between dry and sweet wine, the the different types of wine and gave me a few tasting test (which btw i hated dry wine) but that was it. As time went by I rarely drank until I turned 19 later that my grandfather got sick and I started drinking some of his wine to cope and I found that it was really good, refreshing and interesting all at the same time. Soon I classified the tawny port as my favorite brand of wine. Eventually, my grandfather did become better and I told him that I had been drinking some of his wine, first, he was a bit displeased but he excused the behavior and suggested I get into wine like him and when im more responsible he will let me take any bottles of my choice to my new apartment. I think it’s great but really where do I start to really learn?  I’m mainly trying to self teach not really pursue a career but any suggestions?"
71,eu31tm,Has anyone been wine tasting in the Duoro Valley?,wine,"Hi all,

My partner and I are doing a massive trip to Spain and Portugal and are spending several days in Santa Cruz Do Duoro in April. We are from Canada where it is common to just walk into any winery during their regular hours and head to their tasting room for a selection of wine tastings (for a small fee, or refunded if you purchase some wine). Is this the case in the Duoro? From what I've seen from some google searches, it seems like you have to book a wine tour in advance, where you have to tour their facilities and then get to taste \~2 wines or ports. It doesn't seem to me like tasting rooms are a thing there. Can anyone confirm or give some insight? Thanks in advance!"
72,eu0atv,"My Bota Box Cabernet Sauvignon had sediment in it, was slightly rusty, and tasted chocolatey. It actually tastes kinda good, but should I be concerned?",wine,"I know, I'm not fancy. But I wanted to ask the experts. I just found it odd that a 2017 Bota Box cab would seem to have signs of aging like that. It doesn't taste bad. It's bolder and has a strong dark chocolate flavor, and slightly more rusty in color. Should I be concerned though?"
73,etjwbd,Any love for skin-contact wine?,wine,
74,etsaor,2019 holiday period drinking!,wine,
75,etokdx,Palmer &amp; Co brut reserve,wine,
76,eu0v04,Factor Reset Enomatic Classic,wine,"Anyone know how to factory reset the Enomatic Classic? (The seller didn't provide the technical card for us to reset properly) We just want to get it to behind the bar mode so it's functional.

Thanks!!"
77,ettolr,WSET Level 3 tasting grid mnemonic,wine,Does anybody have a mnemonic device they can share for the level 3 tasting grid?
78,eu0ji0,Can anyone help me identify this wine? Where is it from and if its worth anything.,wine,
79,eu0gfg,Looking for a recommendation to pair with steak (&lt;$200),wine,My wife and I are expecting our first child any day now and I'm looking for a special gift for her.  What are your favorite splurge bottles that go well with a nice steak?
80,etzryo,A friend of mine is making a wine review channel for the casual wine drinker. I figured this sub would appreciate it.,wine,
81,etqq7p,Top Winery,wine,
82,etc84x,Pan Roasted Duck Medallions - Cranberry Ginger Sauce - St Cosme Cote Rotie,wine,
83,etsgu6,"Valle de Guadalupe, Mexico Wines/Wineries",wine,"Hey there! 
I'm going to be spending a month in Baja California this December, and was pleasantly surprised to learn about the Valle de Guadalupe region of Mexico. I had never heard of Mexico being a larger wine producing area. 
Has anyone here gotten to experience Mexican wines? Did you enjoy it? If anyone has been to any of the wineries there I'd be curious to hear your experiences, too!"
84,etujp0,Offsite storage - 50 F / 70% humidity. Too cold?,wine,"I’m shopping around for offsite storage and the most convenient one keeps their room at 50F. 

I’ve always been taught 55 F is the way to go and I keep my current cellar at that temp. 

Anybody have any thoughts on dropping the temp to 50F? 

Most my bottles requires 10-20 years. (First growth, piedmonts, Cali cabs / syrahs)"
85,etufsh,Trying to find a wine type that has as little tartness as possible.,wine,"Hi all,

&amp;#x200B;

In the past I'd tried to enjoy wine but whenever I tried it, my face scrunched up like a baby trying lemon for the first time. I was sure that I read that if that was the case I should try a sweeter wine, so I got gradually sweeter until I was at port. It was still the same problem.

&amp;#x200B;

I did a bit more research this past week and found it likely wasn't the sweetness but the acidity and tartness I was finding unbearable. So I looked in to Merlot. Definitely a marked improvement but I am not sure if it's something I just need to get used to or whether there are practical options for a lower acid red wine type.

&amp;#x200B;

I enjoy whisky and have read that full-bodied Italian is the way to go but looking at them it looks like they're really acidic, so I really don't know where to turn at this point.

&amp;#x200B;

Any advice sincerely appreciated :)"
86,etsp4x,How long is too long for Wine in Terms of Opening it Before I Consume it?,wine,"So I have a bottle of Chenin Blanc in the fridge that I just got last night. I work all day today and plan on drinking it when I get home tonight. Its gonna be about 9 hours from now when I drink it, would it be better to open it now, or to wait until tonight to open it, or would it make no difference at all?"
