,ident,title,subreddit,selftext
1824,ecjx3q,Trip Report: Mostly Barcelona with a bit of Madrid and Toledo,wine,"The fiance and I had the good fortune to burn a flight travel voucher to Spain for a week. We like wine so ended up at a few places worth mentioning for future posterity. Turns out, wine culture in Spain is just as awesome as you'd expect. And it is very accessible for those without big budgets. 

We didn't do any ""wine touring"" per se -- just drinking glasses at bars, and a few bottles at home along the way. This is more of a post on the places and their wine focus than tasting notes on any wine in particular. 

**Barcelona**

* [La Catalista](https://www.lacatalista.com/) . This was our first stop after arriving in Barcelona. It was raining, our AirBnB host was running late, so we walked 50 steps to the closest bar we could find. We ended up coming back for at least a glass every day for the remainder of our trip. It's a wine bar owned by an American ex-pat serving exclusively Catalan wine along with some seriously good food. Focus is on smaller producers making low-intervention wine, especially with less than common local varieties. My first wine there was an a fun off-dry, oxidative white made with [Malvasia de Sitges](https://i.imgur.com/p1PF4Nf.jpg) that was super delicious. Other memorable bits included this [gran reserve cava with cerviche](https://i.imgur.com/qKiFETE.jpg). (And the sumoll in the background was the first time I'd ever heard of or tried that grape.) An example of their [rotating wild card menu](https://i.imgur.com/czZPfgh.jpg) . Overall just a fun little wine bar with a super friendly staff who likes local, well-made wine. *Whose it for:* Folks who want local wine, but need to talk about it in English

* [Quimet y Quimet](https://www.quimetquimet.com/): Dinner our first night. Yes its busy, yes there are tourists, yes there are locals. They are a bit pushy, but damn was everything we ate tasty. We started with their homemade [vermouth and Quimet y Quimet beer]([https://i.imgur.com/YlC6UoI.jpg](https://i.imgur.com/YlC6UoI.jpg)) before sharing some cava and a few more appetizers. Nice thing is you can buy [anything off the wall](https://i.imgur.com/MyxfEnh.jpg) at very reasonable prices to have with your delicious food. No we didn't drink Vina Tondonia. *Whose it for:* Tourists, locals, people who want vermouth a good bottle selection and lots of tasty seafood. 

* [La Graciosa](https://www.facebook.com/lagraciosabcn/): Definitely a nerdy and serious place for natural wine lovers. Lots of funky weird stuff, but didn't take themselves too seriously. Only remembered to snap a pic of the [whites we drank](https://i.imgur.com/7orxNQZ.jpg). Wish we could've stayed longer but they had an event about to start which included a bunch of unlabeled bottles being pulled out of suitcases. If you're into the natty side of natural wine this is your place. *Whose it for:* People open to new wine experiences on the natty wine end of things.

* [Bar Salvatge](https://barsalvatge.com/): This is what happens when natty wine goes mainstream. Loud, popular environment. Ten wines available on tap in different levels of fritzy and fruity to brett-bombs. Not to my taste but an interesting riff to see what happens when this style of natural wines make it to a non-wine nerd crowd who just likes a new approach and feeling to a wine bar. *Whose it for* You want loud vibrant scene, beautiful people, and cheap natty wine from the barrel.

* [La Vinya del Senyor](https://www.facebook.com/vinyadelsenyor/): Stumbled across this place wandering around the neighborhood, and what a delight. Nice outside patio, cozy inside, great seafood and great variety of classic wines by the glass. Not the cheapest place, but compared to what you spend in the US, still a bargin. Oh, and if you like sherry -- they've got a full page of it by the glass. This [manzanilla and oyster pairing](https://i.imgur.com/91SwDvO.jpg) was the pairing of the trip for me. They also had quite the selection of wines on Coravin allowing you taste some spendier bottles like this [local elegant and powerful merlot blend](https://i.imgur.com/nb3BS11.jpg). *Whose it for:* Someone looking for a quite, romantic few glasses on a beautiful patio. And sherry nerds.

* [Boedga Maestrazgo](http://bodegamaestrazgo.com/): [Half bottle shop, half wine bar.](https://i.imgur.com/tzg1A4T.jpg) Everything from very inexpensive (3euro/liter) bulk wine to go, to a whole range of quality producers. Super friendly staff. We drank glasses of this [very nicely acidic bierzo](https://i.imgur.com/7cBmPTz.jpg) that reminded us of cab franc from the Loire which is one of our go to faves. Highly recommend a stop here for a bottle to go, to get mix for sangria, and a glass along the way. We grabbed an inexpensive (15euro?) bottle of 2010 reserva cava for [our picnic the next day.](https://i.imgur.com/5gwpSmT.jpg). *Whose it for*: Someone who needs to buy a few bottles, make sangria, and is looking for that neighborhood bottle shop with well informed staff.

* [Bar Brutal](http://cancisa.cat/): The older sibling of Bar Salvatge and one we enjoyed a good bit more. More toned down from full on natty. Night we happened in was a tasting of Christian Tschida wines -- with [not quite-full pours of 5 cuvees](https://i.imgur.com/py1F6Gc.jpg) for 15 euros a pop.  Somms here were eager to talk about each one and just seemed to really be enjoying their nights. Tons of regulars mixed in with the many tourists you always find in this bit of town. *Whose it for*: You're not cool enough for Bar Salvatge, but you like natural wine and a busy atmosphere with passionate people.

and we saved the big dog for the final night

* [Monvinic](http://www.monvinic.com/): This place is serious. Huge lists, awesome by the glass selection. Quiet atmosphere and very focused customers. A very different vibe, service not eager to explain things to you as perhaps they assume you already know a good bit. The ipad based lists are impressive and--frankly--necessary for navigating. We tasted through 8 half glasses, had some simple tapas (bread and cheese) and were out for about 60euro. Started with [two very different whites](https://i.imgur.com/OuYzuq8.jpg) \-- the muscat being just so pretty, fresh and full of flowers. On to some local reds -- [a small batch sumoll and a marselan](https://i.imgur.com/ReFq2Dm.jpg). The marselan -- a grape I hadn't been exposed to -- was the standout here as bringing just the right amount of cab sauv seriousness to the fruit profile. A bottle I'll certainly look for in the future. Then two more Spanish -- a sulphur and white-pepper nosed [red from the Canary islands](https://i.imgur.com/LTPz2Db.jpg), followed up by a powerful, smooth and just-the-right-amount-of-oak [gran reserva rioja.](https://i.imgur.com/iikjexf.jpg) That was supposed to be the end of it, but we decided we had time for two more wines which generally would be outside our budget. So we had a glass of [1er cru Burgundy](https://i.imgur.com/N2WvbGR.jpg) (which reminded me why I can't drink Burgundy often because I'll fall in love as it just tastes to me like some Platonic ideal of wine in my head, and I can't afford it). And then finished on a [2012 Pomerol](https://i.imgur.com/0ahOQv7.jpg) \-- the fiance's favorite of the night. *Whose it for:* You don't mind a stuffier atmosphere if it means you get to drink incredible wines.

**Toledo**

* No wine bars to mention but we bought [this bottle of ""#Garagewine""](https://i.imgur.com/vThAlEG.jpg) on a whim at a [well stocked local shop](http://casacuartero.com/). After drinking overly-young-overly-oak Rioja for a few days, this was the expression of local cencibel ( Tempranillo ) I needed: medium bodied, fruit forward, plenty of acid, lots of cherries. 

**Madrid**

* [Vino y Compania](http://vinoycompania.blogspot.com/): A small neighborhood wine shop right around the corner from our place. Super friendly staff, big selections in every price range, focused on smaller producers. We had a [few tasty bottles from there](https://i.imgur.com/daGkr5w.jpg) (and one great bottle of ""cuvee"" saison from a nearby beer shop.)
* [La Venencia](https://goo.gl/maps/VHSr1vPCSNMrv8Sm7): Prior to this trip I'd had sherry maybe twice in my life, to start off fancy dinners in England. I was young, it wasn't memorable. This place is going to be to blame for a new habit. Holy shit is it what my palate needed after a bunch of oaked Riojas. Sherry only, all of it straight from the cask. Fino and Manzanilla for 1.80euro,  Amontillado, Oloroso, Palo Cortado for 2.20euro per pour. Simple tapas including the best free olives you'll get anywhere. The vibrancy and slightly yeasty characteristics of fino were tops for me but all were just so new to my taste buds that it was hard to process. No tipping, [no pictures](https://i.imgur.com/HC1h2jB.jpg) (yes I failed, that's our tab). We had a drink here in the afternoon, then came back and closed the place down that night. The fiance and I have an expression for when we find a place we want to melt into for a long time: ""I live here now."" I said that about La Venecia from the 3rd day of our trip when we found it, til we left 6 days later from Barcelona. *Whose it for* Those who need nothing more from life than perfect fresh sherry, simple food, and an interior that hasn't changed since 1930. 

Hope this can be of use to future wine travelers to these cities, and would love to read about other places local wine scenes. Sometimes its just too hard to get out to the vineyards and experiencing a massive variety of wine with passionate people when we travel is the bees knees."
1825,ecpebv,Sterling Vineyards last wine in the tour,wine,"Does anybody know the name of the pinkish wine that's in the last part of the tour at Sterling Vineyards?

It tastes sweet, almost sparkling. I'm sorry if you guys are flinching with how I'm describing them. I don't know anything about wines, I just wanted to buy my aunt who happens to like the wine.

Here's the pic I took of it. [Pink wine](https://i.imgur.com/Auv6pfp.jpg)

Thanks."
1826,ec4t5u,Half Bottle Advent Calendar- Night #17! 2018 Philippe Raimbault Sancerre,wine,
1827,ecjj7c,"Father loves wine, but I am ignorant to wine culture. Are these any good?",wine,
1828,ecgfa6,Test to skip WSET Level 2,wine,Has anybody here taken the exam that allows you to skip Level to and go straight to 3? My understanding is that it’s about 24 mult choice questions and 1 blind tasting. Any insight on this/what it covers? Would love to hear from people who took it to skip to 3.
1829,ecgvpc,Road Reps: Repour/ZOS for your sample bottles?,wine,"I'd like to get my samples budget a little more under control and get the most mileage out of the bottles I present before having to dispose of them.  As of right now, I pull corks, though if the account has a Coravin I'll use it.  For any open bottles, I'll roll around with them the next day (after testing in the AM for freshness and never presenting after the 30-hour mark); any Coravin-ed bottles I consider viable for one week, less if more than a quarter of the bottle was poured.

I have been looking at the [Repour](https://www.repour.com/pages/how-it-works) and [ZOS Halo](https://zos.wine/pages/the-technology) systems.  My primary concern with them is how travel will affect the wine: I am driving a lot every day, including elevation changes (from sea level and over mountain ranges) and winding backroads, not to mention the agitation the bottles face as the sample bag rolls along the sidewalk (sometimes over cobblestones too...).  Conceptually I am wondering how well they would keep sealed under these conditions, if the wine splashing up into the oxygen-absorbing material would compromise/negate it, and what a buyer would think when I present a bottle thusly sealed to him/her.

Are there any road-warrior reps out there with experience using these and if yes, are they worthwhile?  Would it be better to bite the bullet and get a Coravin for selective use (I wouldn't use it for the value-end of the portfolio obviously), or stick to the current gameplan eschewing all preservation methods and open fresh bottles?"
1830,ecgll5,"With Threat of 100 Percent Tariffs on EU Wines and Spirits, Fears Loom Large | SevenFifty Daily",wine,
1831,ecj9q2,2004 &amp; 2005 Barboursville Octagon,wine,I have a couple bottles of these in my cellar. I figure they are past their drink window but thought I'd ask what you thought.
1832,ec8azy,"2015 Tongue in Groove Pinot Noir, NZ - one of my favorite PN's!",wine,
1833,ece4ti,Noob Pairing Question,wine,"Hi everyone! I tried to find an answer on the sub and couldn’t find one. I’m making a pot roast with beef and traditional root vegetables, and wanted to get y’all’s input on what I should pair it with. 

Currently, I’m thinking about having [this](https://www.cellartracker.com/m/wines/2617119) Gigondas with it. 

If y’all don’t think that’s an appropriate pairing, I also have a 2017 Priorat, a 2009 Rioja, and a Matthiasson cabernet that I thought would be good options as well. 

And before anyone suggests Zinfandel, at the moment I’m in a dry county and really don’t want to drive 30 minutes to the county line where my best option is a bottle of Seven Deadly Zins. 

Thanks!"
1834,eci3ug,Recommend me some wines,wine,"I’m mostly a bourbon drinker but the wife likes wine so I’ll drink it with her pretty often. 

I spent a summer working at a winery in college and got pretty in to it but I’ve forgotten everything and I’m ashamed with the generic stuff I’ve been buying. We drink a lot of various Decoy stuff, Meomi Pinot, Federalist House Blend, and Argentina Malbecs. 

What’s some better stuff to try instead of that? For daily drinkers I like to be at $20 or so. But I’ll buy more expensive stuff once in a while too."
1835,ec55sb,Jolie Laide Yorkville Highlands Syrah 2017,wine,
1836,egg1bz,US r/wine-rs. Add your voice in opposition to the proposed 100% tariff on European wine.,wine,"People are going to go out of business if this happens. Lives will be ruined.

**Click Here to Email Your U.S. House Representative:**

https://account.votility.com/enterprise/NAWR/ec/698

**Click Here to Email Your U.S. Senators:**

https://account.votility.com/enterprise/NAWR/ec/697


**WRITE THE U.S. TRADE REPRESENTATIVE**
 
Below is wording for a letter that you can use to write to the U.S. Trade Representative at the website they have created to take input on proposed tariffs.

1. Copy the letter below (or add personalization as you like).

2. Then click on the link at the end of the letter.

3. Then paste the wording into the box provided for writing commentary. Remember to put your name and address in the area reserved for them.


The Honorable Robert Lighthizer
U.S. Trade Representative
Executive Office of the President
600 17th Street, NW
Washington, DC 20006

 

Re: Opposition to Tariffs on Imported Wine from the European Union

 

Dear Amb. Lighthizer:

 

I am writing as a customer and consumer of imported and domestic wines that is concerned with the multiple rounds of tariffs that are being imposed and considered on wine from the European Union (“EU”). I strongly urge you not to punish me, or my fellow wine lovers, or hardworking wine retailers, for problems we didn’t cause. It’s unfair at face value. You should punish those responsible. Punishing Airbus and their suppliers and French digital services companies would be much more effective, as well as fair.

Beginning on October 18, 2019, the U.S. Government imposed a 25-percent tariff on certain French wine as part of retaliatory tariffs against the European Union (“EU”) after the World Trade Organization authorized retaliation for the EU’s failure to comply with WTO rulings on subsidies provided to Airbus. All the while Airbus itself was only issued a 10% tariff. I understand that a 100-percent tariff is proposed on French sparkling wine (consisting mostly of champagne) and that this tariff is part of the Section 301 duties imposed on imports from France as a result of the country’s Digital Services Tax (“DST”). Finally, on December 10, 2019, USTR proposed imposing tariffs of up to 100 percent on all wines from the EU.

Because of these import tariffs, the prices will go up dramatically for wine. Margins on wine are extremely small, and the sale of wine is highly regulated, with virtually every state imposing a three-tier distribution system with markups occurring at each tier of distribution. Thus, a 25-percent tariff on wine imports will likely result in a 50-percent increase and a 100-percent tariff on wine imports will likely result in a 150-percent increase in prices for a consumer like me.

 

There is no substitute for imports of wine from the EU. Wines from the EU are different from domestic wines and wines from other countries as a matter of consumer taste. In addition, because it takes many years to plant new grape vineyards and allow the vineyards to produce mature fruit that can be harvested to make wine, it will take at least a decade before the U.S. domestic wine industry could ever be in a position to begin replacing wine imports from the EU.

 

As a wine consumer, I do not understand why individual consumers like me and small U.S. businesses should suffer because of a dispute involving Boeing and Airbus or France’s digital services tax. Retaliatory tariffs on these matters should target Airbus and their suppliers who benefitted from the subsidies, and French digital services companies.


**Click To Email the above letter to the U.S. Trade Representative:**

https://www.regulations.gov/comment?D=USTR-2019-0003-2518"
1837,epsjwk,***MWC Experimental Series #1 - January 2020 Tasting Notes Post!**,wine,"Hi Everyone!

Welcome to the first tasting notes post for 2020!  It sounds like this might prove to be a popular change to the MWC based on the selection post, and I hope that it is echoed in this thread!  I hope everyone has had a chance to find their selections.  I had to order mine in (NZ pinot is not very easy to find here locally beyond Kim Crawford.  But I was able to find a couple, and I hope you did too.  If not, no worry, just post what you were ablle to find!   As a reminder, this  months selection is:

**Grape:** Pinot Noir  
**Country and Region #1:** USA, Pacific North West  
**Country and Region #2:** New Zealand, Any

That's right!  Two wines this month!  And as a reminder, if you can only find wine from one region and not the other, thats quite alright.  Just post what you can.  Remember, in your notes, be sure to include: a) a link to a picture of the bottle  and a filled glass; b) the name (if there is one), the producer, the  country/region, the year; c) your notes; and d) your overall  recommendation (whether beautiful or terrible, food pairings, etc.).

Need help with your notes?   [Wine Folly has a great article!](http://winefolly.com/review/write-excellent-wine-tasting-notes/)

I look forward to reading your notes!  And as always, I am open to suggestions for future challenges, including for the Experimental Series!"
1838,euyqfh,Sweet Mother of Beaujolais. Yann Bertrand - Phenix,wine,
1839,euv17k,Pretty good .,wine,
1840,euywej,Ch. Giscours 2005 - still exciting 15 years later,wine,
1841,ev69hk,Vertical tasting of 8 Bollinger VVF (1996-2010) from back in September - My biggest wine experience ever!,wine,
1842,euoxht,Pleasant surprise from a monster Turley,wine,
1843,eutp9c,"Just bought this, was looking for some advice on the best way to drink. Should I decant? etc, thanks!",wine,
1844,eux5hy,ANONIS 2017 by LE GRAPPERIE,wine,
1845,ev29dx,The Lacroix of wines,wine,
1846,ev60np,Venice Day Trips Wine Tours,wine,Has anyone ever done a tour through Venice Day Trips?  If so would you recommend it?  Thanks.
1847,eusmy9,Domaine de Villaine - Bouzeron - Burgundy aligoté,wine,
1848,euzb2n,Free smoke taint tests for bushfire-hit grape growers in South Australia,wine,
1849,euyl5s,Piquette? Really?,wine,
1850,ev3wx0,mulled wine question,wine,"peeps can you make mulled wine without cooking it in a sauce pan, like just putting the spices and waiting for them to infuse sangria style ?"
1851,euzzl5,Going to Burgundy in May,wine,"Hi, I'll be going to Burgundy during May and was wondering if I could get some info on the some wineries I have to visit. Some sites recommend Joseph Drouhin and Olivier Leflaive for visits but are they worth the price, especially the premium options. Cheers"
1852,euwnpp,"At 2°C of warming, the area suitable for wine grapes could drop by 56%; at 4°C, 85%. Switching grape varieties could greatly reduce climate change impacts on wine growing regions. But there are limits to this adaptation; it's much more effective at +2°C than +4°C",wine,
1853,euw1zc,Does anyone else have a problem with peeling labels? Only seems to happen to the far niente bottles. Both the Chardonnay and Cabernet do this. Non of the other bottles do. Is there a way to stop this or fix it with out damaging it?,wine,
1854,ev1rd7,Widely Agreed Upon Wines,wine,"So with mid range bourbon almost everyone agrees on ones like Elijah Craig, Knob Creek, Makers Mark.

What Wines are in that higher mid range that everyone agrees are must trys :)"
1855,ev1a6s,Any San Francisco have recommendations on a good wine bar?,wine,I'm visiting SF and I'm looking for places that sell by the ounce or have flights available. Ideally a nice space for me to do a mini wine class for a friend who wants to get into wine.
1856,eukatf,1984 Ste. Chapelle Riesling,wine,
1857,euxx0z,Napa Cabernet by Price,wine,
1858,euvxc8,Looking for a summer job,wine,"Hi,

I'm a 23 year-old man from the Netherlands working at a wine bar and busy with the Dutch equivalent of WSET3.

For the summer, I'm looking for a winery (preferably in France or Italy) to work at. I could help with tours, hospitality services or some others jobs if needed. I'm not interested in earning any money, just looking for a place to stay and learn about wine for about two weeks.

If anyone has a tip or suggestion, please let me know! 😊"
1859,ev0k6p,Help me know more about this wine,wine,"Okay, so I bought this wine in Argentina a couple of years ago when I was 15-16 (my dad bought it, I just handed him the money) and I brought it home with me, I know it is a cheap wine but I was wondering maybe what is the price point or maybe some facts/advise that you could tell me about it. Thanks a lot.

https://imgur.com/gallery/jLXdHd2"
1860,ev0iz4,Climate Change Could Shrink Wine Regions Dramatically,wine,
1861,eug4f0,Visited Napa for the first Time. Was Not Disappointed.,wine,
1862,euu194,Any tips on getting out of a wine club...?,wine,"Also posted in /r/legaladvice, but I suspect you guys will have some interesting answers. :) 

I recently moved and joined a wine club through a local shop: every quarter there's a club event with food/drinks and you pick out your wine from multiple local wineries. If you do not attend the event, you get assigned wine from whatever is left over and you pick it up/it's shipped.

My job has unexpectedly involved a lot of travel lately, and I would like to bow out of the club*. I responded to their most recent email - an invitation to the next member event - letting them know I can't attend due to work, and in light of my new job could I please cancel my subscription and hopefully rejoin in the summer when travel will have subsided? I was told ""we can let you skip this one event, but our wine club membership is for one year."" 

If I'm stuck in this club I'll live, of course. But has anyone else successfully extricated themselves from a club...and how? 

*In the event it's important, reasons include: I've missed previous wine club event since joining due to work-related travel for a new job and the event itself was my main reason for joining - so I could make local friends!, my fiance decided to stop drinking wine which makes a club less economical/fun...and frankly, I am not very impressed with the wines they have chosen for me."
1863,euytmq,Wine suggestions while in France (Provence),wine,Will be traveling to France and spending most of my time in le sud. The plan as of now is to pick up wine in town at the store and take with us to have picnic style at various locations when hiking/exploring the country side and beaches. Any suggestions on wines to be on the lookout for? Options that are both affordable and ones that are “only in the south of France” are greatly appreciated! Personal preference is red but am well aware the region is known for rose!
1864,euvi2x,I am a starter in white sand I enjoy Sancerre and Pouilly-Fumé ones the best. Where to go to enjoy other grapes or other regions next?,wine,
1865,euru8c,Recommendation for under $75,wine,"Hi all, 

My fiancée has a huge celebration coming up and I want to get a nice bottle of wine for her to pair with the Zalton Bordeaux glass I got her. 

Looking for a Cab Sav. I live in PA, so somewhat limited based on what the state has. 

She likes dry, oaky, fruity, tobacco notes.

The last “nice” bottle we had was Palermo Orin Swift I believe is what it was called. She liked it a lot. Was hoping to find something even better than that. 

Hope this helps and hope you guys can help me!"
1866,euro1i,Are these 4 2017 Bordeaux bottles worth $180?,wine,
1867,eux6h4,California whites,wine,"Whenever I try a Californian wine, it's always as nervous as my dog when the doorbell rings... Is there better regions or grapes for whites, down there? Some kind of guidance for my next trip to the wine store? 🙃"
1868,eud77k,"Alain Graillot Crosez-hermitage, 2017 + Cheetos Flamin' Hots NV",wine,
1869,eu85ze,"Celebrating my birthday a week late, but worth the wait.",wine,
1870,eusrgn,Decant these or not?,wine,
1871,eudz5g,Subway sparkling wine,wine,
